record_id,lot_id,defect_code,defect_rate,discovery_date,containment_date,disposition_date,release_date,lot_status,closure_text
NCR-S04-2025-05-01,LOT-M007,DC-512,3.53,2025-05-11,2025-05-13,2025-05-18,2025-05-20,Closed,Deviation attributed to calibration drift on gauge 39; recalibrated and verified against standard.
NCR-S04-2025-05-02,LOT-1091,DC-204,2.63,2025-05-09,2025-05-10,2025-05-13,2025-05-18,Rework,Sampling error under AQL plan corrected; inspector re-qualified on the revised sampling table.
NCR-S04-2025-05-03,LOT-1097,DC-118,3.99,2025-05-09,2025-05-10,2025-05-16,2025-05-19,Hold,Closure justified by 'trend within historical norms' without attaching the supporting data.
NCR-S04-2025-05-04,LOT-1094,DC-311,2.76,2025-05-06,2025-05-07,2025-05-13,2025-05-15,Hold,Handling damage identified at packaging; foam insert redesigned and first-article re-approved.
NCR-S04-2025-05-05,LOT-1039,DC-204,2.14,2025-05-15,2025-05-18,2025-05-20,2025-05-24,Closed,Process deviation from a missed cleaning step; 5S audit added to the shift changeover checklist.
NCR-S04-2025-05-06,LOT-1050,DC-311,4.08,2025-05-04,2025-05-07,2025-05-08,2025-05-14,Closed,Deviation attributed to calibration drift on gauge 24; recalibrated and verified against standard.
NCR-S04-2025-05-07,LOT-1047,DC-101,2.61,2025-05-05,2025-05-08,2025-05-10,2025-05-15,Closed,Investigation closed same day as opened with identical wording to two other unrelated lots.
NCR-S04-2025-05-08,LOT-1115,DC-101,2.76,2025-05-04,2025-05-05,2025-05-08,2025-05-13,Closed,Containment isolated 33 affected units; supplier notified and incoming inspection tightened.
