record_id,lot_id,defect_code,defect_rate,discovery_date,containment_date,disposition_date,release_date,lot_status,closure_text
NCR-S07-2025-05-01,LOT-1205,DC-311,13.97,2025-05-15,2025-05-16,2025-05-19,2025-05-24,Hold,Handling damage identified at packaging; foam insert redesigned and first-article re-approved.
NCR-S07-2025-05-02,LOT-1154,DC-230,13.0,2025-05-06,2025-05-08,2025-05-12,2025-05-16,Hold,Sampling error under AQL plan corrected; inspector re-qualified on the revised sampling table.
NCR-S07-2025-05-03,LOT-1121,DC-204,13.13,2025-05-14,2025-05-16,2025-05-18,2025-05-24,Released,Vendor CAPA referenced; corrective action verified on subsequent lots with no recurrence noted.
NCR-S07-2025-05-04,LOT-1044,DC-512,11.81,2025-05-07,2025-05-10,2025-05-13,2025-05-15,Rework,Containment isolated 18 affected units; supplier notified and incoming inspection tightened.
NCR-S07-2025-05-05,LOT-1153,DC-101,14.32,2025-05-07,2025-05-09,2025-05-12,2025-05-16,Hold,Nonconformance closed after rework of 3 units; effectiveness check scheduled next cycle.
NCR-S07-2025-05-06,LOT-1031,DC-512,10.14,2025-05-03,2025-05-04,2025-05-08,2025-05-11,Closed,Material lot quarantined pending CoA review; disposition set to use-as-is after engineering waiver.
