record_id,lot_id,defect_code,defect_rate,discovery_date,containment_date,disposition_date,release_date,lot_status,closure_text
NCR-S09-2025-03-01,LOT-1001,DC-405,4.12,2025-03-03,2025-03-06,2025-03-09,2025-03-13,Closed,Deviation attributed to calibration drift on gauge 78; recalibrated and verified against standard.
NCR-S09-2025-03-02,LOT-1101,DC-405,3.66,2025-03-01,2025-03-03,2025-03-05,2025-03-09,Rework,Root cause traced to a mislabeled fixture on line 2; operator retrained and check sheet revised.
NCR-S09-2025-03-03,LOT-1125,DC-512,3.14,2025-03-07,2025-03-10,2025-03-11,2025-03-16,Closed,Deviation attributed to calibration drift on gauge 48; recalibrated and verified against standard.
NCR-S09-2025-03-04,LOT-1214,DC-311,3.56,2025-03-15,2025-03-18,2025-03-21,2025-03-25,Quarantine,Containment isolated 21 affected units; supplier notified and incoming inspection tightened.
NCR-S09-2025-03-05,LOT-1143,DC-311,4.75,2025-03-06,2025-03-09,2025-03-12,2025-03-16,Released,Vendor CAPA referenced; corrective action verified on subsequent lots with no recurrence noted.
NCR-S09-2025-03-06,LOT-1030,DC-101,3.39,2025-03-13,2025-03-15,2025-03-19,2025-03-22,Hold,Sampling error under AQL plan corrected; inspector re-qualified on the revised sampling table.
